{
  "schema_version": "1",
  "status": "clean",
  "review": {
    "findings": [],
    "overall_explanation": "No actionable defects found.",
    "overall_confidence": 0.93
  },
  "failure": null,
  "metadata": {
    "target": {
      "mode": "local",
      "snapshot_hash": "sha256:clean-fixture",
      "head_revision": "0123456789abcdef",
      "base_revision": "",
      "commit_revision": "",
      "files": [
        {
          "file_path": "main.go",
          "line_ranges": [
            {
              "start_line": 1,
              "end_line": 20
            }
          ]
        }
      ]
    },
    "provider": {
      "name": "codex",
      "model": "gpt-5.6-sol",
      "version": "0.146.0"
    },
    "attempts": [
      {
        "number": 1,
        "outcome": "valid",
        "duration_ms": 1200,
        "error_class": null
      }
    ],
    "duration_ms": 1300,
    "web_access": false,
    "protocol_recovery": {
      "applied": false,
      "strategy": null
    }
  }
}
